{
  "schema_version": "1.0",
  "command": "report",
  "input_config": "${REPO_ROOT}/output/usb-hub-engineering-review-WRU6p3/rev-b/config.toml",
  "report_pdf": "${REPO_ROOT}/output/usb-hub-engineering-review-WRU6p3/rev-b/usb_hub_surrogate_B_report.pdf",
  "report_summary_json": "${REPO_ROOT}/output/usb-hub-engineering-review-WRU6p3/rev-b/usb_hub_surrogate_B_report_summary.json",
  "overall_status": "pass",
  "overall_score": 92,
  "ready_for_manufacturing_review": true,
  "config_name": "usb_hub_surrogate_B",
  "run_id": "2dddd675-09e6-45fb-ac43-7195b727985d",
  "git_commit": "4dba0d32fe1b10f2266f27501165e56df9f943af",
  "git_branch": "codex/studio-quality-summary-fix",
  "generated_at": "2026-09-25T12:27:17.156Z",
  "runtime_status": {
    "mode": "macos-bundle",
    "available": true,
    "status": "ready",
    "executable_detected": true,
    "probe_status": "usable"
  },
  "inputs_consumed": [
    {
      "key": "config",
      "label": "Input config",
      "path": "${REPO_ROOT}/output/usb-hub-engineering-review-WRU6p3/rev-b/config.toml",
      "status": "available",
      "required": true,
      "note": null
    },
    {
      "key": "dfm_input",
      "label": "In-memory DFM results",
      "path": null,
      "status": "in_memory",
      "required": true,
      "note": null
    },
    {
      "key": "fem_input",
      "label": "In-memory FEM results",
      "path": null,
      "status": "not_run",
      "required": true,
      "note": null
    },
    {
      "key": "tolerance_input",
      "label": "In-memory tolerance results",
      "path": null,
      "status": "not_run",
      "required": true,
      "note": null
    }
  ],
  "artifacts_referenced": [
    {
      "key": "report_pdf",
      "label": "Engineering report PDF",
      "path": "${REPO_ROOT}/output/usb-hub-engineering-review-WRU6p3/rev-b/usb_hub_surrogate_B_report.pdf",
      "status": "generated",
      "required": true,
      "note": null
    },
    {
      "key": "report_summary_json",
      "label": "Report summary JSON",
      "path": "${REPO_ROOT}/output/usb-hub-engineering-review-WRU6p3/rev-b/usb_hub_surrogate_B_report_summary.json",
      "status": "generated",
      "required": true,
      "note": null
    },
    {
      "key": "create_quality",
      "label": "Create quality JSON",
      "path": "${REPO_ROOT}/output/usb-hub-engineering-review-WRU6p3/rev-b/usb_hub_surrogate_B_create_quality.json",
      "status": "available",
      "required": true,
      "note": null
    },
    {
      "key": "drawing_quality",
      "label": "Drawing quality JSON",
      "path": "${REPO_ROOT}/output/usb-hub-engineering-review-WRU6p3/rev-b/usb_hub_surrogate_B_drawing_quality.json",
      "status": "available",
      "required": true,
      "note": null
    },
    {
      "key": "dfm",
      "label": "DFM analysis",
      "path": null,
      "status": "in_memory",
      "required": true,
      "note": null
    },
    {
      "key": "fem",
      "label": "FEM analysis",
      "path": null,
      "status": "not_run",
      "required": false,
      "note": null
    },
    {
      "key": "tolerance",
      "label": "Tolerance analysis",
      "path": null,
      "status": "not_available",
      "required": false,
      "note": null
    },
    {
      "key": "traceability_json",
      "label": "Drawing traceability JSON",
      "path": "${REPO_ROOT}/output/usb-hub-engineering-review-WRU6p3/rev-b/usb_hub_surrogate_B_traceability.json",
      "status": "available",
      "required": false,
      "note": null
    },
    {
      "key": "extracted_drawing_semantics",
      "label": "Extracted drawing semantics JSON",
      "path": "${REPO_ROOT}/output/usb-hub-engineering-review-WRU6p3/rev-b/usb_hub_surrogate_B_extracted_drawing_semantics.json",
      "status": "available",
      "required": false,
      "note": "Advisory extraction from generated drawing evidence only."
    },
    {
      "key": "create_manifest",
      "label": "Create output manifest",
      "path": "${REPO_ROOT}/output/usb-hub-engineering-review-WRU6p3/rev-b/usb_hub_surrogate_B_manifest.json",
      "status": "available",
      "required": false,
      "note": null
    },
    {
      "key": "drawing_manifest",
      "label": "Drawing output manifest",
      "path": "${REPO_ROOT}/output/usb-hub-engineering-review-WRU6p3/rev-b/usb_hub_surrogate_B_drawing_manifest.json",
      "status": "available",
      "required": false,
      "note": null
    },
    {
      "key": "feature_catalog",
      "label": "Conservative feature catalog JSON",
      "path": "${REPO_ROOT}/output/usb-hub-engineering-review-WRU6p3/rev-b/usb_hub_surrogate_B_feature_catalog.json",
      "status": "available",
      "required": false,
      "note": "Feature recognition is conservative and evidence-scoped."
    },
    {
      "key": "report_manifest",
      "label": "Report output manifest",
      "path": null,
      "status": "not_available",
      "required": false,
      "note": null
    }
  ],
  "blocking_issues": [],
  "warnings": [],
  "recommended_actions": [
    "Separate overlapping note or dimension text and reroute leaders if needed.",
    "Add a required diameter dimension intent for \"hole_D1\".",
    "Add a required diameter dimension intent for \"hole_D2\".",
    "Add a required diameter dimension intent for \"hole_H1\".",
    "Add a required diameter dimension intent for \"hole_H2\"."
  ],
  "missing_optional_artifacts": [
    "tolerance",
    "report_manifest"
  ],
  "top_risks": [],
  "surfaces": {
    "create_quality": {
      "available": true,
      "status": "pass",
      "score": null,
      "invalid_shape": false,
      "blocking_issues": [],
      "warnings": []
    },
    "drawing_quality": {
      "available": true,
      "status": "pass",
      "score": 89,
      "missing_required_dimensions": [],
      "conflict_count": 0,
      "overlap_count": 0,
      "traceability_coverage_percent": 100,
      "semantic_quality": {
        "decision": "unknown",
        "advisory_decision": "unknown",
        "enforceable": false,
        "score": null,
        "critical_features_total": 0,
        "critical_features_covered": 0,
        "required_dimensions_total": 0,
        "required_dimensions_present": 0,
        "missing_required_dimensions": [],
        "required_notes_missing": [],
        "required_views_missing": [],
        "traceability": {
          "required_dimensions_total": 0,
          "linked_required_dimensions": 0,
          "missing_required_dimensions": [],
          "unknown_required_dimensions": []
        },
        "missing_critical_information": [],
        "required_blockers": [],
        "optional_missing_information": [],
        "suggested_actions": [],
        "suggested_action_details": [],
        "extracted_evidence": {
          "status": "available",
          "advisory_only": true,
          "file": "${REPO_ROOT}/output/usb-hub-engineering-review-WRU6p3/rev-b/usb_hub_surrogate_B_extracted_drawing_semantics.json",
          "path": "${REPO_ROOT}/output/usb-hub-engineering-review-WRU6p3/rev-b/usb_hub_surrogate_B_extracted_drawing_semantics.json",
          "sources": [
            {
              "artifact_type": "svg",
              "path": "${REPO_ROOT}/output/usb-hub-engineering-review-WRU6p3/rev-b/usb_hub_surrogate_B_drawing.svg",
              "inspected": true,
              "method": "svg_text_scan"
            },
            {
              "artifact_type": "svg",
              "path": "${REPO_ROOT}/output/usb-hub-engineering-review-WRU6p3/rev-b/usb_hub_surrogate_B_drawing.svg",
              "inspected": false,
              "method": "svg_title_block_material_pair"
            },
            {
              "artifact_type": "svg",
              "path": "${REPO_ROOT}/output/usb-hub-engineering-review-WRU6p3/rev-b/usb_hub_surrogate_B_drawing.svg",
              "inspected": true,
              "method": "svg_view_group_metadata"
            },
            {
              "artifact_type": "layout_report",
              "path": "${REPO_ROOT}/output/usb-hub-engineering-review-WRU6p3/rev-b/usb_hub_surrogate_B_layout_report.json",
              "inspected": true,
              "method": "layout_report_views"
            },
            {
              "artifact_type": "dimension_map",
              "path": "${REPO_ROOT}/output/usb-hub-engineering-review-WRU6p3/rev-b/usb_hub_surrogate_B_dimension_map.json",
              "inspected": true,
              "method": "dimension_map_reference"
            },
            {
              "artifact_type": "traceability",
              "path": "${REPO_ROOT}/output/usb-hub-engineering-review-WRU6p3/rev-b/usb_hub_surrogate_B_traceability.json",
              "inspected": true,
              "method": "traceability_reference"
            }
          ],
          "coverage": {
            "required_dimensions": {
              "total": 0,
              "extracted": 0,
              "missing": 0,
              "unknown": 0,
              "unsupported": 0,
              "extracted_percent": null
            },
            "required_notes": {
              "total": 0,
              "extracted": 0,
              "missing": 0,
              "unknown": 0,
              "unsupported": 0,
              "extracted_percent": null
            },
            "required_views": {
              "total": 0,
              "extracted": 0,
              "missing": 0,
              "unknown": 0,
              "unsupported": 0,
              "extracted_percent": null
            },
            "total_required": 0,
            "total_extracted": 0,
            "total_missing": 0,
            "total_unknown": 0,
            "total_unsupported": 0
          },
          "required_dimensions": [],
          "required_notes": [],
          "required_views": [],
          "unmatched_dimensions": [
            {
              "extracted_id": "svg_text_002",
              "raw_text": "142",
              "category": null,